{
  "schema_version": 3,
  "as_of": "2026-10-04T12:00:00Z",
  "requirements": [
    {
      "id": "enabled",
      "subject": "alarm-device",
      "path": [
        "enabled"
      ],
      "expected": true,
      "observation_id": "fresh",
      "max_age_seconds": 120,
      "action_id": "set-alarm"
    },
    {
      "id": "time",
      "subject": "alarm-device",
      "path": [
        "time"
      ],
      "expected": "07:00",
      "observation_id": "fresh",
      "max_age_seconds": 120,
      "action_id": "set-alarm"
    },
    {
      "id": "volume",
      "subject": "alarm-device",
      "path": [
        "volume"
      ],
      "expected": 5,
      "observation_id": "old",
      "max_age_seconds": 120,
      "action_id": null
    },
    {
      "id": "refund-change",
      "subject": "reservation",
      "path": [
        "refunded"
      ],
      "expected": false,
      "observation_id": "refund-final",
      "max_age_seconds": 120,
      "action_id": "refund-attempt",
      "check": "equal",
      "baseline_id": "refund-before",
      "requires_change": true
    }
  ],
  "actions": [
    {
      "id": "set-alarm",
      "status": "succeeded"
    },
    {
      "id": "refund-attempt",
      "status": "succeeded"
    }
  ],
  "observations": [
    {
      "id": "fresh",
      "subject": "alarm-device",
      "observed_at": "2026-10-04T11:59:00Z",
      "state": {
        "enabled": true,
        "time": "07:30"
      }
    },
    {
      "id": "old",
      "subject": "alarm-device",
      "observed_at": "2026-10-04T11:45:00Z",
      "state": {
        "volume": 5
      }
    },
    {
      "id": "refund-final",
      "subject": "reservation",
      "observed_at": "2026-10-04T11:59:00Z",
      "state": {
        "refunded": false
      }
    }
  ],
  "baselines": [
    {
      "id": "refund-before",
      "subject": "reservation",
      "observed_at": "2026-10-04T11:58:00Z",
      "state": {
        "refunded": false
      }
    }
  ]
}
