{
  "schema_version": 3,
  "as_of": "2026-10-04T12:00:00Z",
  "requirements": [
    {
      "id": "temperature",
      "subject": "alarm-device",
      "path": [
        "temperature"
      ],
      "expected": {
        "min": 18,
        "max": 25,
        "max_inclusive": false
      },
      "observation_id": "fresh",
      "max_age_seconds": 120,
      "action_id": "set-alarm",
      "check": "range"
    },
    {
      "id": "labels",
      "subject": "alarm-device",
      "path": [
        "labels"
      ],
      "expected": "active",
      "observation_id": "fresh",
      "max_age_seconds": 120,
      "action_id": "set-alarm",
      "check": "contains"
    },
    {
      "id": "reference",
      "subject": "alarm-device",
      "path": [
        "reference"
      ],
      "expected": "^[A-Z]{2}[0-9]{2}$",
      "observation_id": "fresh",
      "max_age_seconds": 120,
      "action_id": "set-alarm",
      "check": "regex"
    },
    {
      "id": "refund-change",
      "subject": "reservation",
      "path": [
        "refunded"
      ],
      "expected": false,
      "observation_id": "refund-final",
      "max_age_seconds": 120,
      "action_id": "refund-attempt",
      "check": "equal",
      "baseline_id": "refund-before",
      "requires_change": true
    }
  ],
  "actions": [
    {
      "id": "set-alarm",
      "status": "succeeded"
    },
    {
      "id": "refund-attempt",
      "status": "succeeded"
    }
  ],
  "observations": [
    {
      "id": "fresh",
      "subject": "alarm-device",
      "observed_at": "2026-10-04T11:59:00Z",
      "state": {
        "enabled": true,
        "time": "07:30",
        "temperature": 22,
        "labels": [
          "active"
        ],
        "reference": "AB12"
      }
    },
    {
      "id": "old",
      "subject": "alarm-device",
      "observed_at": "2026-10-04T11:45:00Z",
      "state": {
        "volume": 5
      }
    },
    {
      "id": "refund-final",
      "subject": "reservation",
      "observed_at": "2026-10-04T11:59:00Z",
      "state": {
        "refunded": false
      }
    }
  ],
  "baselines": [
    {
      "id": "refund-before",
      "subject": "reservation",
      "observed_at": "2026-10-04T11:58:00Z",
      "state": {
        "refunded": false
      }
    }
  ]
}
